{
  "meeting_id": "de29be1c625c",
  "title": "セキュリティインシデント対応体制 定例会議",
  "date": "2026-04-07T10:00:00Z",
  "duration_seconds": 3600,
  "meeting_type": "regular",
  "context": "セキュリティインシデント対応体制に関する定例会議",
  "participants": [
    {
      "name": "田中",
      "role": "organizer",
      "affiliation": "セキュリティチームリーダー"
    },
    {
      "name": "佐藤",
      "role": "decision_maker",
      "affiliation": "CISO"
    },
    {
      "name": "鈴木",
      "role": "proposer",
      "affiliation": "SOCアナリスト"
    },
    {
      "name": "山田",
      "role": "reporter",
      "affiliation": "IT基盤担当"
    },
    {
      "name": "高橋",
      "role": "observer",
      "affiliation": "法務"
    }
  ],
  "participant_dynamics": [
    {
      "from": "田中",
      "to": "鈴木",
      "relation": "instruction",
      "topic": "インシデント対応フローの改善",
      "detail": "先月のインシデント対応の振り返り結果を共有"
    },
    {
      "from": "鈴木",
      "to": "田中",
      "relation": "report",
      "topic": "インシデント対応フローの改善",
      "detail": "先月のフィッシング対応の振り返り結果"
    },
    {
      "from": "佐藤",
      "to": "鈴木",
      "relation": "proposal_approval",
      "topic": "インシデント対応フローの改善",
      "detail": "案Aを推す"
    },
    {
      "from": "田中",
      "to": "鈴木",
      "relation": "instruction",
      "topic": "インシデント対応フローの改善",
      "detail": "対応フロー文書の更新"
    },
    {
      "from": "田中",
      "to": "山田",
      "relation": "instruction",
      "topic": "SOCツール刷新の予算",
      "detail": "見積もりの進捗確認"
    },
    {
      "from": "山田",
      "to": "田中",
      "relation": "report",
      "topic": "SOCツール刷新の予算",
      "detail": "見積もり進捗と各社比較"
    },
    {
      "from": "高橋",
      "to": "山田",
      "relation": "question_answer",
      "topic": "SOCツール刷新の予算",
      "detail": "各社のデータ保管場所について質問"
    },
    {
      "from": "佐藤",
      "to": "山田",
      "relation": "instruction",
      "topic": "SOCツール刷新の予算",
      "detail": "技術評価スコアリングと法務コストを含めた総合比較の準備"
    },
    {
      "from": "田中",
      "to": "山田",
      "relation": "instruction",
      "topic": "次回訓練の計画",
      "detail": "バックアップ復旧手順の更新"
    },
    {
      "from": "田中",
      "to": "鈴木",
      "relation": "instruction",
      "topic": "次回訓練の計画",
      "detail": "訓練シナリオの作成"
    }
  ],
  "agenda": [
    {
      "title": "インシデント対応フローの改善",
      "status": "decided",
      "summary": "先月のフィッシング対応の振り返りから、SOCからCSIRTへのエスカレーション基準が曖昧であったことが判明。鈴木氏から到達数ベースと影響度ベースの2つの改善案が提示され、シンプルで属人化しにくく、見逃しリスクが低いという理由から「フィッシング判定メール10件以上到達で自動エスカレーション」という基準が採用された。",
      "speakers": [
        "田中",
        "鈴木",
        "佐藤",
        "山田"
      ],
      "utterances": [
        {
          "speaker": "田中",
          "text": "では最初の議題、インシデント対応フローの改善について。鈴木さん、先月のインシデント対応の振り返り結果を共有してください。",
          "timestamp": ""
        },
        {
          "speaker": "鈴木",
          "text": "はい。先月のフィッシング対応では、初動から封じ込めまでに4時間かかりました。原因は、SOCからCSIRTへのエスカレーション基準が曖昧だったことです。具体的には、フィッシングメールの到達数が10件を超えた時点でエスカレーションすべきでしたが、現行ルールでは「重大と判断した場合」という抽象的な表現になっていて、判断に30分以上かかりました。",
          "timestamp": ""
        },
        {
          "speaker": "佐藤",
          "text": "それは改善が必要ですね。定量的な基準を設けるべきです。",
          "timestamp": ""
        },
        {
          "speaker": "鈴木",
          "text": "はい、提案があります。2つのアプローチを検討しました。案Aは到達数ベース、つまりフィッシングメール10件以上で自動エスカレーション。案Bは影響度ベースで、マネージャー以上のアカウントが対象に含まれる場合にエスカレーション。",
          "timestamp": ""
        },
        {
          "speaker": "山田",
          "text": "案Aだと、大量のスパムメールが来たときに毎回エスカレーションになりませんか？",
          "timestamp": ""
        },
        {
          "speaker": "鈴木",
          "text": "そのリスクはありますが、スパムとフィッシングの判別は既にフィルタリングツールで対応しています。スパムを除外した上での到達数なので、誤報率は低いと見ています。",
          "timestamp": ""
        },
        {
          "speaker": "佐藤",
          "text": "私は案Aを推します。理由は2つ。まずシンプルで属人化しにくいこと。次に、見逃しリスクが案Bより低いことです。案Bはマネージャー以外の重要アカウントを見落とす可能性がある。",
          "timestamp": ""
        },
        {
          "speaker": "田中",
          "text": "私も同意です。では、エスカレーション基準を「フィッシング判定メール10件以上到達で自動エスカレーション」に変更します。鈴木さん、対応フロー文書の更新をお願いします。期限は来週金曜、4月17日で。",
          "timestamp": ""
        },
        {
          "speaker": "鈴木",
          "text": "承知しました。",
          "timestamp": ""
        }
      ],
      "discussion_points": [
        "先月のフィッシング対応における初動の遅れ（4時間）",
        "SOCからCSIRTへのエスカレーション基準の曖昧さ",
        "現行ルールの「重大と判断した場合」という抽象的な表現の問題点",
        "鈴木氏からの2つの改善案（案A: 到達数ベース、案B: 影響度ベース）",
        "案Aにおけるスパムメールによる誤エスカレーションのリスクとその対策",
        "案Bにおけるマネージャー以外の重要アカウント見落としのリスク"
      ],
      "decisions": [
        {
          "what": "エスカレーション基準を「フィッシング判定メール10件以上到達で自動エスカレーション」に変更する。",
          "why": "シンプルで属人化しにくく、マネージャー以外の重要アカウントを見落とすリスクが低いと判断されたため。",
          "alternatives_considered": [
            {
              "option": "案B: 影響度ベース（マネージャー以上のアカウントが対象に含まれる場合にエスカレーション）",
              "rejected_because": "マネージャー以外の重要アカウントを見落とす可能性があるため。"
            }
          ],
          "decided_by": [
            "佐藤",
            "田中"
          ]
        }
      ],
      "action_items": [
        {
          "owner": "鈴木",
          "task": "対応フロー文書の更新",
          "due": "2026-04-17",
          "context": "エスカレーション基準の変更に伴う"
        }
      ],
      "unresolved": []
    },
    {
      "title": "SOCツール刷新の予算",
      "status": "pending",
      "summary": "現行のSIEMライセンスが9月に切れるため、3社から見積もりを取得。各社のコストと機能が比較されたが、高橋氏からB社のデータ保管場所（シンガポール）に関する法務上の懸念が提起された。佐藤氏の指示により、次回会議までに技術評価スコアリングと法務コストを含めた総合比較を行うことになった。",
      "speakers": [
        "田中",
        "山田",
        "高橋",
        "佐藤"
      ],
      "utterances": [
        {
          "speaker": "田中",
          "text": "次の議題、SOCツール刷新の予算について。山田さん、見積もりの進捗はどうですか？",
          "timestamp": ""
        },
        {
          "speaker": "山田",
          "text": "はい。現行のSIEMライセンスが9月に切れます。3社から見積もりを取りました。A社が年間1200万円、B社が年間800万円、C社が年間1500万円です。機能比較では、B社はログ取り込み量に制限がありますが、コストパフォーマンスは最も優れています。A社はフル機能、C社はAI分析が強みです。",
          "timestamp": ""
        },
        {
          "speaker": "高橋",
          "text": "法務の観点から質問です。各社のデータ保管場所はどこですか？国内法令を考慮する必要があります。",
          "timestamp": ""
        },
        {
          "speaker": "山田",
          "text": "A社は東京リージョン、B社はシンガポール、C社は東京リージョンです。",
          "timestamp": ""
        },
        {
          "speaker": "高橋",
          "text": "B社はシンガポールですか。個人情報保護の観点から、越境転送に関する追加の契約条項が必要になりますね。その交渉コストも含めて検討すべきです。",
          "timestamp": ""
        },
        {
          "speaker": "佐藤",
          "text": "良い指摘です。まず各社の技術評価をスコアリングした上で、法務コストも含めた総合比較を次回の会議までに出してもらえますか？",
          "timestamp": ""
        },
        {
          "speaker": "山田",
          "text": "わかりました。技術評価スコアリングと総合コスト比較を次回会議の4月21日までに準備します。",
          "timestamp": ""
        },
        {
          "speaker": "佐藤",
          "text": "ただし、予算の最終承認は経営会議を通す必要があります。経営会議は5月中旬なので、それまでに結論を出さないといけません。",
          "timestamp": ""
        },
        {
          "speaker": "田中",
          "text": "承知しました。タイムラインがタイトですね。",
          "timestamp": ""
        }
      ],
      "discussion_points": [
        "SIEMライセンスの9月期限切れ",
        "3社からの見積もり比較（A社:1200万円、B社:800万円、C社:1500万円）",
        "各社の機能とコストパフォーマンス（B社はログ取り込み量制限ありだが高コスパ）",
        "高橋氏によるデータ保管場所に関する法務的懸念（B社シンガポール）",
        "越境転送に関する追加契約条項と交渉コストの必要性",
        "経営会議での最終承認が必要であり、5月中旬までに結論を出す必要性"
      ],
      "decisions": [],
      "action_items": [
        {
          "owner": "山田",
          "task": "技術評価スコアリングと法務コストを含めた総合比較の準備",
          "due": "2026-04-21",
          "context": "SOCツール刷新の予算検討のため"
        }
      ],
      "unresolved": [
        {
          "issue": "SOCツールの選定と予算承認",
          "blocker": "技術評価と法務コストを含めた総合比較が未完了。経営会議での最終承認が必要。",
          "carry_forward_to": "次回会議（4月21日）"
        }
      ]
    },
    {
      "title": "次回訓練の計画",
      "status": "decided",
      "summary": "前回のファイルレスマルウェア訓練の成功を受け、次回訓練のテーマについて議論。鈴木氏からランサムウェアのインシデント対応訓練が提案され、承認された。山田氏からバックアップ復旧手順の更新が必要であるとの指摘があり、山田氏には手順書更新、鈴木氏には訓練シナリオ作成がそれぞれ4月末までの期限で依頼された。訓練は5月実施を目標とする。",
      "speakers": [
        "田中",
        "鈴木",
        "山田"
      ],
      "utterances": [
        {
          "speaker": "田中",
          "text": "次の議題、訓練計画について。",
          "timestamp": ""
        },
        {
          "speaker": "田中",
          "text": "前回のファイルレスマルウェア訓練は好評でした。次回は何をテーマにしましょうか。",
          "timestamp": ""
        },
        {
          "speaker": "鈴木",
          "text": "ランサムウェアのインシデント対応訓練を提案します。実際のランサムウェア検知からバックアップ復旧までの一連のフローを、机上で実施する形です。",
          "timestamp": ""
        },
        {
          "speaker": "山田",
          "text": "バックアップ復旧の訓練は良いですね。ただ、現状のバックアップ復旧手順は最後に更新したのが去年の8月で、その後インフラ構成が変わっています。訓練前に手順書の更新が必要です。",
          "timestamp": ""
        },
        {
          "speaker": "田中",
          "text": "それは重要なポイントです。山田さん、バックアップ復旧手順の更新をお願いします。5月の訓練実施を目標に、4月末までに手順書を完成させてください。",
          "timestamp": ""
        },
        {
          "speaker": "山田",
          "text": "了解しました。",
          "timestamp": ""
        },
        {
          "speaker": "田中",
          "text": "鈴木さんは訓練シナリオの作成をお願いします。同じく4月末まで。",
          "timestamp": ""
        },
        {
          "speaker": "鈴木",
          "text": "はい、対応します。",
          "timestamp": ""
        }
      ],
      "discussion_points": [
        "前回のファイルレスマルウェア訓練の成功",
        "鈴木氏からのランサムウェアインシデント対応訓練の提案",
        "山田氏からのバックアップ復旧手順の更新の必要性（インフラ構成変更のため）"
      ],
      "decisions": [
        {
          "what": "次回の訓練テーマをランサムウェアのインシデント対応訓練とし、5月実施を目標に進める。",
          "why": "鈴木氏の提案が受け入れられ、バックアップ復旧の重要性が認識されたため。",
          "alternatives_considered": [],
          "decided_by": [
            "田中"
          ]
        }
      ],
      "action_items": [
        {
          "owner": "山田",
          "task": "バックアップ復旧手順の更新",
          "due": "2026-04-30",
          "context": "ランサムウェア訓練実施のため、現状の手順書が古い"
        },
        {
          "owner": "鈴木",
          "task": "訓練シナリオの作成",
          "due": "2026-04-30",
          "context": "ランサムウェア訓練実施のため"
        }
      ],
      "unresolved": []
    }
  ],
  "key_takeaways": [
    "フィッシングメールのエスカレーション基準を「10件以上到達で自動エスカレーション」に改定することが決定し、鈴木氏がフロー文書を4月17日までに更新する。",
    "SOCツール刷新については、山田氏が次回会議（4月21日）までに技術評価スコアリングと法務コストを含めた総合比較を準備する。最終承認は5月中旬の経営会議。",
    "次回のセキュリティ訓練はランサムウェア対応をテーマとし、5月実施を目標に準備を開始する。",